{
  "assignmentEvidenceRef": {
    "digest": "sha256:6edba31b2cd58cb8a12b1a41301c1fa2235daecafb0a87ef9b1a58cadbcd78fa",
    "objectId": "allocation:experimental-fabric-pilot-r1",
    "objectKind": "allocation-manifest",
    "ownerId": "study"
  },
  "assignmentPolicy": "blocked",
  "assignments": [
    {
      "blockRef": "HARNESS-EDIT-ADDRESSING-002",
      "levelId": "deepseek-v4-flash",
      "unitRef": "trial:001"
    },
    {
      "blockRef": "HARNESS-EDIT-ADDRESSING-002",
      "levelId": "deepseek-flash",
      "unitRef": "trial:002"
    },
    {
      "blockRef": "HARNESS-EDIT-MULTIREGION-003",
      "levelId": "deepseek-flash",
      "unitRef": "trial:003"
    },
    {
      "blockRef": "HARNESS-REPO-REPAIR-001",
      "levelId": "deepseek-flash",
      "unitRef": "trial:004"
    },
    {
      "blockRef": "HARNESS-REPO-REPAIR-001",
      "levelId": "deepseek-v4-flash",
      "unitRef": "trial:005"
    },
    {
      "blockRef": "HARNESS-EDIT-ADDRESSING-002",
      "levelId": "deepseek-v4-flash",
      "unitRef": "trial:006"
    },
    {
      "blockRef": "HARNESS-EDIT-MULTIREGION-003",
      "levelId": "deepseek-v4-flash",
      "unitRef": "trial:007"
    },
    {
      "blockRef": "HARNESS-REPO-REPAIR-001",
      "levelId": "deepseek-v4-flash",
      "unitRef": "trial:008"
    },
    {
      "blockRef": "HARNESS-REPO-REPAIR-001",
      "levelId": "deepseek-flash",
      "unitRef": "trial:009"
    },
    {
      "blockRef": "HARNESS-EDIT-ADDRESSING-002",
      "levelId": "deepseek-flash",
      "unitRef": "trial:010"
    },
    {
      "blockRef": "HARNESS-EDIT-MULTIREGION-003",
      "levelId": "deepseek-flash",
      "unitRef": "trial:011"
    },
    {
      "blockRef": "HARNESS-EDIT-MULTIREGION-003",
      "levelId": "deepseek-v4-flash",
      "unitRef": "trial:012"
    }
  ],
  "contractDigest": "sha256:75e4546fd8fd172b16c55d55318a15eb625a3a2b531dcfad192e0582cff06d53",
  "contractId": "intervention:model-selection-r1",
  "experimentId": "experiment:experimental-fabric-model-harness-pilot-r1-20260928",
  "frozenBaseDigest": "sha256:998a9e233db6a7860334280fa8fa362b64d494533496b558d4de4ce2725a8dc7",
  "kind": "ordivon.experimental-intervention-contract",
  "nonClaims": [
    "Model assignment does not grant Provider effect authority."
  ],
  "schemaVersion": 1,
  "treatmentFactor": {
    "factorId": "factor:model",
    "levels": [
      {
        "levelId": "deepseek-flash",
        "value": "deepseek-flash"
      },
      {
        "levelId": "deepseek-v4-flash",
        "value": "deepseek-v4-flash"
      }
    ]
  },
  "unitOfAssignment": "run"
}
